{
  "schema": 1,
  "updated_at": null,
  "rolling": {
    "7d": {
      "tokens": {
        "input": 0,
        "output": 0
      },
      "by_model": {},
      "files_edited": 0,
      "sessions": 0,
      "active_minutes": 0
    },
    "30d": {
      "tokens": {
        "input": 0,
        "output": 0
      },
      "by_model": {},
      "files_edited": 0,
      "sessions": 0,
      "active_minutes": 0
    }
  },
  "by_session": {},
  "by_runtime": {}
}
